title,genre,release_year,rating,comments
"Inception","Science-fiction",2010,4.8,"Un chef-d'oeuvre de Christopher Nolan."
"The Godfather","Drame",1972,4.9,"Un classique du cinema americain."
"Parasite","Thriller",2019,4.6,"Une critique sociale poignante."
"Frozen II","Animation",2019,4.2,"Une suite magnifique avec de superbes chansons."
"Interstellar","Science-fiction",2014,4.7,"Un voyage epoustouflant a travers le temps et l'espace."
"Gladiator","Action",2000,4.5,"Une epopee spectaculaire sur la Rome antique."
